source,title,link,date,n_comments,comment_1_author,comment_1_date,comment_1_text,comment_2_author,comment_2_date,comment_2_text,comment_3_author,comment_3_date,comment_3_text,comment_4_author,comment_4_date,comment_4_text,comment_5_author,comment_5_date,comment_5_text,comment_6_author,comment_6_date,comment_6_text,comment_7_author,comment_7_date,comment_7_text,comment_8_author,comment_8_date,comment_8_text,comment_9_author,comment_9_date,comment_9_text,comment_10_author,comment_10_date,comment_10_text,comment_11_author,comment_11_date,comment_11_text,comment_12_author,comment_12_date,comment_12_text,comment_13_author,comment_13_date,comment_13_text,comment_14_author,comment_14_date,comment_14_text,comment_15_author,comment_15_date,comment_15_text
Cousas de Carragal,MARÍN. FESTIVIDAD DE SANTA CECILIA. CONCIERTOS MUSICALES DE 'SONSGALIA' Y LA BANDA DE MÚSICA MARINENSE,https://cousasdecarragal.blogspot.com/2024/11/marin-festividad-de-santa-cecilia.html,2024-11-22T08:46:00,1,Anónimo,"2 de diciembre de 2024, 13:29",Gracias!!!  Por recordar  a nuestro abuelo  el director Sampablo.,,,,,,,,,,,,,,,,,,,,,,,,,,,,,,,,,,,,,,,,,,
Cousas de Carragal,MARIN. IMOS O TEMA. EL POSIBLE DESTINO DEL EDIFICIO PAIS-BALADRÓN.,https://cousasdecarragal.blogspot.com/2024/11/marin-imos-o-tema-el-posible-destino.html,2024-11-21T10:44:00,0,,,,,,,,,,,,,,,,,,,,,,,,,,,,,,,,,,,,,,,,,,,,,
Cousas de Carragal,MARÍN. CARA AL 25N.  LA INFLUENCER FEMINISTA SINDY TAKANASHI HABLA HOY SOBRE 'CIBERACOSO Y MACHISMO'. MUSEO M. TORRES 19.30h,https://cousasdecarragal.blogspot.com/2024/11/marin-cara-al-25n-la-influencer.html,2024-11-21T08:08:00,0,,,,,,,,,,,,,,,,,,,,,,,,,,,,,,,,,,,,,,,,,,,,,
Cousas de Carragal,MARIN. DEFUNCIONES. FALLECIMIENTO DEL SEÑOR JOSÉ M. ROSALES Y LA SEÑORA CARMEN GRAÑA (80 AÑOS),https://cousasdecarragal.blogspot.com/2024/11/marin-defunciones-fallecimiento-del_20.html,2024-11-20T16:17:00,0,,,,,,,,,,,,,,,,,,,,,,,,,,,,,,,,,,,,,,,,,,,,,
Cousas de Carragal,MARIN. LA 'MASACRE' FORESTAL DEL LAGO DE CASTIÑEIRAS. PRIMERA DENUNCIA FORMAL CONTRA LA TALA DE LAS 'TUIAS' Y OTRAS ESPECIES,https://cousasdecarragal.blogspot.com/2024/11/marin-la-masacre-forestaln-del-lago-de.html,2024-11-20T13:15:00,0,,,,,,,,,,,,,,,,,,,,,,,,,,,,,,,,,,,,,,,,,,,,,
Cousas de Carragal,"MARÍN. UNHA DE CAL, OUTRA DE AREA. TRUCHAS Y TALAS EN EL LAGO DE CASTIÑEIRAS. POR ANGEL G. CARRAGAL",https://cousasdecarragal.blogspot.com/2024/11/marin-unha-de-cal-outra-de-area-truchas.html,2024-11-20T10:30:00,0,,,,,,,,,,,,,,,,,,,,,,,,,,,,,,,,,,,,,,,,,,,,,
Cousas de Carragal,MARÍN. DEFUNCIONES. FALLECIMIENTO DE LA SEÑORA ASUNCIÓN VÁZQUEZ GÓMEZ A LOS 91 AÑOS DE EDAD. DEP,https://cousasdecarragal.blogspot.com/2024/11/marin-defunciones-fallecimiento-de-la_20.html,2024-11-20T08:25:00,0,,,,,,,,,,,,,,,,,,,,,,,,,,,,,,,,,,,,,,,,,,,,,
Cousas de Carragal,MARÍN. DEFUNCIONES. FALLECIMIENTO DE LA SEÑORA HERMOSINDA RODRÍGUEZ SOTO A LOS 102 AÑOS DE EDAD. DEP,https://cousasdecarragal.blogspot.com/2024/11/marin-defunciones-fallecimiento-de-la_19.html,2024-11-19T08:38:00,0,,,,,,,,,,,,,,,,,,,,,,,,,,,,,,,,,,,,,,,,,,,,,
Cousas de Carragal,MARÍN. OBITUARIO.  PRIMER ANIVERSARIO FALLECIMIENTO DE LA SEÑORA ELSA MALLO CARRAGAL. DEP,https://cousasdecarragal.blogspot.com/2024/11/marin-obituario-primer-aniversario.html,2024-11-19T08:11:00,0,,,,,,,,,,,,,,,,,,,,,,,,,,,,,,,,,,,,,,,,,,,,,
Cousas de Carragal,MARIN. AXENDA GRÁFICA NOVEMBRO. ¿A DÓNDE IR?,https://cousasdecarragal.blogspot.com/2024/11/marin-axenda-grafica-novembro-donde-ir.html,2024-11-19T07:45:00,0,,,,,,,,,,,,,,,,,,,,,,,,,,,,,,,,,,,,,,,,,,,,,
Cousas de Carragal,MARÍN. LAS RUTAS SALUDABLES DE LA AECC. POR ANGEL G. CARRAGAL,https://cousasdecarragal.blogspot.com/2024/11/marin-las-rutas-saludables-de-la-aecc.html,2024-11-18T07:54:00,0,,,,,,,,,,,,,,,,,,,,,,,,,,,,,,,,,,,,,,,,,,,,,
Cousas de Carragal,MARÍN. DEFUNCIONES. PARROQUIA DE LOURIZÁN. FALLECIMIENTO DE ROSA LAMEIRO (90 AÑOS) Y ÁNGEL TORRES (88 AÑÓS),https://cousasdecarragal.blogspot.com/2024/11/marin-defunciones-parroquia-de-lourizan.html,2024-11-18T07:48:00,0,,,,,,,,,,,,,,,,,,,,,,,,,,,,,,,,,,,,,,,,,,,,,
Cousas de Carragal,MARÍN. DEFUNCIONES. PARROQUIA SANTA MARÍA DO CAMPO. FALLECIMIENTO DE LA SEÑORA CARMEN FERRADÁS OUTEDA A LOS 87 AÑOS DE EDAD. DEP,https://cousasdecarragal.blogspot.com/2024/11/marin-defunciones-parroquia-santa-maria.html,2024-11-18T07:28:00,0,,,,,,,,,,,,,,,,,,,,,,,,,,,,,,,,,,,,,,,,,,,,,
Cousas de Carragal,"MARIN. BUENAS VIBRACIONES. HOMENAJES Y DISTINCIONES. ""MARÍN, UNHA VILA EN FLOR'",https://cousasdecarragal.blogspot.com/2024/11/marin-buenas-vibraciones-homenajes-y.html,2024-11-17T10:12:00,0,,,,,,,,,,,,,,,,,,,,,,,,,,,,,,,,,,,,,,,,,,,,,
Cousas de Carragal,MARIN. DEFUNCIONES. FALLECIMIENTO DE JOSÉ PAMPIN (61 AÑOS) Y RICARDO FERRADÁS (82 AÑOS) DEP,https://cousasdecarragal.blogspot.com/2024/11/marin-defunciones-fallecimiento-de-jose.html,2024-11-16T07:43:00,0,,,,,,,,,,,,,,,,,,,,,,,,,,,,,,,,,,,,,,,,,,,,,
Cousas de Carragal,MARÍN. LA PRINCESA LEONOR PROCLAMADA HIJA ADOPTIVA DE LA VILLA MARINENSE. CON LOS VOTOS A FAVOR DEL PP Y PSOE,https://cousasdecarragal.blogspot.com/2024/11/marin-la-princesa-leonor-proclamada.html,2024-11-15T11:38:00,0,,,,,,,,,,,,,,,,,,,,,,,,,,,,,,,,,,,,,,,,,,,,,
Cousas de Carragal,MARÍN. AXENDA GRÁFICA. ¿A DÓNDE IR?,https://cousasdecarragal.blogspot.com/2024/11/marin-axenda-grafica-donde-ir_15.html,2024-11-15T07:24:00,0,,,,,,,,,,,,,,,,,,,,,,,,,,,,,,,,,,,,,,,,,,,,,
Cousas de Carragal,MARÍN. AXENDA GRÁFICA. ¿A DÓNDE IR?,https://cousasdecarragal.blogspot.com/2024/11/marain-axenda-grafica-donde-ir.html,2024-11-14T09:41:00,0,,,,,,,,,,,,,,,,,,,,,,,,,,,,,,,,,,,,,,,,,,,,,
Cousas de Carragal,MARÍN. DEFUNCIONES. FALLECIMIENTO DE LA SEÑORA GENOVEVA AMOEDO (86 AÑOS) Y JOSÉ A. PÉREZ JUIZ (79 AÑOS) DEP,https://cousasdecarragal.blogspot.com/2024/11/marin-defunciones-fallecimiento-de-la_13.html,2024-11-13T20:30:00,0,,,,,,,,,,,,,,,,,,,,,,,,,,,,,,,,,,,,,,,,,,,,,
Cousas de Carragal,MARÍN. DEFUNCIONES. FALLECIMIENTO DE VICENTE GONZÁLEZ BASTÓN A LOS 76 AÑOS DE EDAD. DEP,https://cousasdecarragal.blogspot.com/2024/11/marin-defunciones-fallecimiento-de.html,2024-11-13T20:10:00,0,,,,,,,,,,,,,,,,,,,,,,,,,,,,,,,,,,,,,,,,,,,,,
Cousas de Carragal,MARIN. AXENDA GRÁFICA. ¿A DÓNDE IR?,https://cousasdecarragal.blogspot.com/2024/11/marin-axenda-grafica-donde-ir_13.html,2024-11-13T10:27:00,0,,,,,,,,,,,,,,,,,,,,,,,,,,,,,,,,,,,,,,,,,,,,,
Cousas de Carragal,"MARIN. TRAGEDIA DANA. RESULTADO DEL CONCIERTO A 'TRES BANDAS'. GESTO SOLIDARIO, MUSICAL Y ECONÓMICO.",https://cousasdecarragal.blogspot.com/2024/11/marin-tragedia-dana-resultado-del.html,2024-11-13T09:47:00,0,,,,,,,,,,,,,,,,,,,,,,,,,,,,,,,,,,,,,,,,,,,,,
Cousas de Carragal,MARÍN. AXENDA GRÁFICA. ¿A DÓNDE IR?,https://cousasdecarragal.blogspot.com/2024/11/marin-axenda-grafica-donde-ir_12.html,2024-11-12T08:38:00,0,,,,,,,,,,,,,,,,,,,,,,,,,,,,,,,,,,,,,,,,,,,,,
Cousas de Carragal,MARIN. DEFUNCIONES. FALLECIMIENTO DEL SEÑOR EUGENIO CRESPO VILLEGAS A LOS 85 AÑOS DE EDAD. DEP,https://cousasdecarragal.blogspot.com/2024/11/marin-defunciones-fallecimiento-del_11.html,2024-11-11T13:39:00,0,,,,,,,,,,,,,,,,,,,,,,,,,,,,,,,,,,,,,,,,,,,,,
Cousas de Carragal,MARÍN. 'IN MEMORIAM'  A CARLOS PARATCHA VÁZQUEZ (1900-1974). POR ANGEL G-. CARRAGAL,https://cousasdecarragal.blogspot.com/2024/11/marin-in-memoriam-carlos-paratcha.html,2024-11-10T19:23:00,0,,,,,,,,,,,,,,,,,,,,,,,,,,,,,,,,,,,,,,,,,,,,,
Cousas de Carragal,MARIN. DEFUNCIONES. FALLECIMIENTO DE LA SEÑORA ISAURA RODRIGUEZ PAZOS A LOS 85 AÑOS DE EDAD. DEP,https://cousasdecarragal.blogspot.com/2024/11/marin-defunciones-fallecimiento-de-la_10.html,2024-11-10T13:46:00,0,,,,,,,,,,,,,,,,,,,,,,,,,,,,,,,,,,,,,,,,,,,,,
Cousas de Carragal,"MARÍN. MÚSICA SOLIDARIA. EL CONCIERTO 'A TRES BANDAS' HOMENAJE VÍCTIMAS DANA, SE MANTIENE",https://cousasdecarragal.blogspot.com/2024/11/marin-musica-solidaria-el-concierto.html,2024-11-10T09:05:00,0,,,,,,,,,,,,,,,,,,,,,,,,,,,,,,,,,,,,,,,,,,,,,
Cousas de Carragal,MARÍN. VAMOS AO TEMA: A PROBLEMÁTICA DA FALTA DE APARCAMENTO. O DEBATE EN PÚBLICO DO BNG E AS SÚAS ALTERNATIVAS,https://cousasdecarragal.blogspot.com/2024/11/marin-vamos-ao-tema-problematica-da.html,2024-11-10T08:17:00,0,,,,,,,,,,,,,,,,,,,,,,,,,,,,,,,,,,,,,,,,,,,,,
Cousas de Carragal,"MARIN. DEFUNCIONES. FALLECIMIENTO DE LA SEÑORA MARÍA DEL CARMEN CARBALLO PEÓN A LOS 93 AÑOS DE EDAD, DEP",https://cousasdecarragal.blogspot.com/2024/11/marin-defunciones-fallecimiento-de-la.html,2024-11-09T07:23:00,0,,,,,,,,,,,,,,,,,,,,,,,,,,,,,,,,,,,,,,,,,,,,,
Cousas de Carragal,"MARÍN. BUENAS VIBRACIONES. FELIZ 'FINDE' ENTRE MÚSICA, CASTAÑAS Y COGUMELOS.",https://cousasdecarragal.blogspot.com/2024/11/marin-buenas-vibraciones-feliz-finde.html,2024-11-08T08:47:00,0,,,,,,,,,,,,,,,,,,,,,,,,,,,,,,,,,,,,,,,,,,,,,
Cousas de Carragal,MARÍN. TRAGEDIA DANA. TESTIMONIO DE UNA VOLUNTARIA: CARMEN FERNÁNDEZ GUTIÉRREZ,https://cousasdecarragal.blogspot.com/2024/11/marin-tragedia-dana-testimonio-de-una.html,2024-11-07T09:18:00,0,,,,,,,,,,,,,,,,,,,,,,,,,,,,,,,,,,,,,,,,,,,,,
Cousas de Carragal,MARÍN. DAMNIFICADOS DANA. CONCIERTO SOLIDARIO A 'TRES BANDAS',https://cousasdecarragal.blogspot.com/2024/11/marin-damnificados-dana-concierto.html,2024-11-07T08:50:00,0,,,,,,,,,,,,,,,,,,,,,,,,,,,,,,,,,,,,,,,,,,,,,
Cousas de Carragal,MARÍN. OJO AVIZOR. LOS APARCAMIENTOS DISUASORIOS Y SUS PRESUNTOS OKUPAS,https://cousasdecarragal.blogspot.com/2024/11/marin-ojo-avizor-los-aparcamientos.html,2024-11-06T08:03:00,0,,,,,,,,,,,,,,,,,,,,,,,,,,,,,,,,,,,,,,,,,,,,,
Cousas de Carragal,MARÍN. DEFUNCIONES. FALLECIMIENTO DEL SEÑOR CARLOS RAMIRO SALORIO ROBLES. DEP,https://cousasdecarragal.blogspot.com/2024/11/marin-defunciones-fallecimiento-del_5.html,2024-11-05T15:39:00,0,,,,,,,,,,,,,,,,,,,,,,,,,,,,,,,,,,,,,,,,,,,,,
Cousas de Carragal,MARÍN. SOLIDARIDADE. EXITOSA RECOLLIDA DE ALIMENTOS PARA OS POBOS AFECTADOS POLA DANA,https://cousasdecarragal.blogspot.com/2024/11/marin-solidaridad-exitosa-recogida-de.html,2024-11-04T08:15:00,0,,,,,,,,,,,,,,,,,,,,,,,,,,,,,,,,,,,,,,,,,,,,,
Cousas de Carragal,"MARÍN. A TALA DE TUIAS E OUTRAS ÁRBORES. ""DESACOUGO NO LAGO DE CASTIÑEIRAS"". POR GASPAR BERNÁRDEZ VILLEGAS. DOUTOR EN INVESTIGACIÓN AGRARIA E FORESTAL",https://cousasdecarragal.blogspot.com/2024/11/marin-tala-de-tuias-e-outras-arbores.html,2024-11-03T19:32:00,0,,,,,,,,,,,,,,,,,,,,,,,,,,,,,,,,,,,,,,,,,,,,,
Cousas de Carragal,"MARÍN. LA POLÉMICA TALA 'DAS TUIAS DO LAGO DE CASTIÑEIRAS'. ""ESTABAN ENFERMAS Y HACIAN PELIGRAR LA SEGURIDAD DE LAS PERSONAS""",https://cousasdecarragal.blogspot.com/2024/11/marin-la-polemica-tala-das-tuias-do.html,2024-11-03T09:08:00,0,,,,,,,,,,,,,,,,,,,,,,,,,,,,,,,,,,,,,,,,,,,,,
Cousas de Carragal,MARÍN. MENSAJES DE PETICIÓN DE AYUDA A PUEBLOS AFECTADOS POR LA DANA,https://cousasdecarragal.blogspot.com/2024/11/marin-mensajes-de-peticion-de-ayuda.html,2024-11-02T13:29:00,0,,,,,,,,,,,,,,,,,,,,,,,,,,,,,,,,,,,,,,,,,,,,,
Cousas de Carragal,MARÍN. AXENDA GRÁFICA. ¿A DÓNDE IR ?,https://cousasdecarragal.blogspot.com/2024/11/marin-axenda-grafica-donde-ir.html,2024-11-01T13:35:00,0,,,,,,,,,,,,,,,,,,,,,,,,,,,,,,,,,,,,,,,,,,,,,
Cousas de Carragal,MARÍN. DEFUNCIONES. FALLECIMIENTO DEL SEÑOR MANUEL QUERO PAZOS A LOS 70 AÑOS DE EDAD. DEP,https://cousasdecarragal.blogspot.com/2024/11/marin-defunciones-fallecimiento-del.html,2024-11-01T08:53:00,0,,,,,,,,,,,,,,,,,,,,,,,,,,,,,,,,,,,,,,,,,,,,,
Cousas de Carragal,MARIN. HISTORIA Y TRADICIÓN. EL CEMENTERIO DE CHAN DA RAÑA (1901) POR ANGEL G. CARRAGAL,https://cousasdecarragal.blogspot.com/2024/11/marin-historia-y-tradicion-el.html,2024-11-01T08:16:00,0,,,,,,,,,,,,,,,,,,,,,,,,,,,,,,,,,,,,,,,,,,,,,
Cousas de Carragal,MARÍN. AXENDA GRÁFICA. MES DE NOVEMBRO. ¿A DÓNDE IR?,https://cousasdecarragal.blogspot.com/2024/10/marin-axenda-grafica-mes-de-novembro.html,2024-10-31T11:21:00,0,,,,,,,,,,,,,,,,,,,,,,,,,,,,,,,,,,,,,,,,,,,,,
Cousas de Carragal,"MARIN. PREMIO DÍA DE LA HISPANIDAD, FRANCISCO SOLLA CRESPO, UN MARINENSE EJEMPLAR EN LA DIÁSPORA",https://cousasdecarragal.blogspot.com/2024/10/marin-premio-dia-de-la-hispanidad.html,2024-10-31T10:22:00,0,,,,,,,,,,,,,,,,,,,,,,,,,,,,,,,,,,,,,,,,,,,,,
Cousas de Carragal,MARÍN. A TRAXEDIA DA DANA. LUTO OFICIAL E MINUTO DE SILENCIO ANTE A CASA CONSISTORIAL,https://cousasdecarragal.blogspot.com/2024/10/marin-traxedia-da-dana-luto-oficial-e.html,2024-10-31T08:46:00,0,,,,,,,,,,,,,,,,,,,,,,,,,,,,,,,,,,,,,,,,,,,,,
Cousas de Carragal,MARÍN DEFUNCIONES. FALLECIMIENTO DE LA SEÑORA ADOLFINA ROSALES GARCÍA A LOS 83 AÑOS DE EDAD. DEP,https://cousasdecarragal.blogspot.com/2024/10/marin-defunciones-fallecimiento-de-la_31.html,2024-10-31T08:38:00,0,,,,,,,,,,,,,,,,,,,,,,,,,,,,,,,,,,,,,,,,,,,,,
Cousas de Carragal,MARIN. OBITUARIO. MISA POR EL FALLECIMIENTO DEL SEÑOR JUAN JOSÉ ROSALES CARRAGAL. DEP,https://cousasdecarragal.blogspot.com/2024/10/marin-obituario-misa-por-el.html,2024-10-30T11:25:00,0,,,,,,,,,,,,,,,,,,,,,,,,,,,,,,,,,,,,,,,,,,,,,
Cousas de Carragal,MARÍN. A OPINIÓN DO LECTOR. 'TEMPOS TRISTES PARA O LAGO DE CASTIÑEIRAS'.  AUTOR: GASPAR BERNÁRDEZ VILLEGAS,https://cousasdecarragal.blogspot.com/2024/10/marin-opinion-do-lector-tempos-tristes.html,2024-10-30T08:20:00,0,,,,,,,,,,,,,,,,,,,,,,,,,,,,,,,,,,,,,,,,,,,,,
Cousas de Carragal,MARIN. OJO AVIZOR. EL Y 'TÚ MÁS' LLEGA A LA POLITICA LOCAL.,https://cousasdecarragal.blogspot.com/2024/10/marin-ojo-avizor-el-y-tu-mas-llega-la.html,2024-10-29T08:38:00,0,,,,,,,,,,,,,,,,,,,,,,,,,,,,,,,,,,,,,,,,,,,,,
Cousas de Carragal,MARÍN. FALLECIMIENTO DE LA SEÑORA NIEVES LAMOSO AROSA A LOS 77 AÑOS DE EDAD. DEP,https://cousasdecarragal.blogspot.com/2024/10/marin-fallecimiento-de-la-senora-nieves.html,2024-10-28T14:49:00,0,,,,,,,,,,,,,,,,,,,,,,,,,,,,,,,,,,,,,,,,,,,,,
Cousas de Carragal,"MARÍN, LA VISITA DE FILO P. ALCÁNTARA, MISS GALICIA. POR ANGEL G. CARRAGAL",https://cousasdecarragal.blogspot.com/2024/10/marin-la-visita-de-filo-p-alcantara.html,2024-10-28T08:57:00,0,,,,,,,,,,,,,,,,,,,,,,,,,,,,,,,,,,,,,,,,,,,,,
Cousas de Carragal,MARIN. DEFUNCIONES. FALLECIMIENTO DE CARMEN RIVERA SUEIRO A LOS 81 AÑOS DE EDAD. DEP,https://cousasdecarragal.blogspot.com/2024/10/marin-defunciones-fallecimiento-de_28.html,2024-10-28T08:24:00,0,,,,,,,,,,,,,,,,,,,,,,,,,,,,,,,,,,,,,,,,,,,,,
Cousas de Carragal,MARÍN. DEFUNCIONES. FALLECIMIENTO DE ELOY PASTORIZA VILLANUEVA A LOS 35 AÑOS DE EDAD. DEP,https://cousasdecarragal.blogspot.com/2024/10/marin-defunciones-fallecimiento-de-eloy_54.html,2024-10-28T08:02:00,0,,,,,,,,,,,,,,,,,,,,,,,,,,,,,,,,,,,,,,,,,,,,,
Cousas de Carragal,MARÍN. DEFUNCIONES. FALLECIMIENTO DEL SEÑOR JUAN JOSÉ ROSALES CARRAGAL. DEP,https://cousasdecarragal.blogspot.com/2024/10/marin-defunciones-fallecimiento-del_26.html,2024-10-26T19:35:00,0,,,,,,,,,,,,,,,,,,,,,,,,,,,,,,,,,,,,,,,,,,,,,
Cousas de Carragal,MARÍN. DEFUNCIONES. FALLECIMIENTO DEL SEÑOR ANDRÉS GUIANCE CASAL. 92 AÑOS DE EDAD. DEP,https://cousasdecarragal.blogspot.com/2024/10/marin-defunciones-fallecimiento-del_25.html,2024-10-25T16:16:00,0,,,,,,,,,,,,,,,,,,,,,,,,,,,,,,,,,,,,,,,,,,,,,
Cousas de Carragal,MARÍN. DEFUNCIONES. FALLECIMIENTO DE LA SEÑORA ANTONIA MARTÍNEZ SANTIAGO A LOS 93 AÑOS DE EDAD. DEP,https://cousasdecarragal.blogspot.com/2024/10/marin-defunciones-fallecimiento-de-la_25.html,2024-10-25T15:30:00,0,,,,,,,,,,,,,,,,,,,,,,,,,,,,,,,,,,,,,,,,,,,,,
Cousas de Carragal,MARIN- DEFUNCIONES. FALLECIMIENTO DEL SEÑOR MANUEL CARBALLO FERRADÁS A LOS 68 AÑOS DE EDAD. DEP,https://cousasdecarragal.blogspot.com/2024/10/marin-defunciones-fallecimiento-del_21.html,2024-10-21T08:30:00,0,,,,,,,,,,,,,,,,,,,,,,,,,,,,,,,,,,,,,,,,,,,,,
Cousas de Carragal,MARÍN. DEFUNCIONES. FALLECIMIENTO DEL SEÑOR AGUSTÍN DEL RÍO IGLESIAS A LOS 78 AÑOS DE EDAD. DEP,https://cousasdecarragal.blogspot.com/2024/10/marin-defunciones-fallecimiento-del_19.html,2024-10-19T19:51:00,0,,,,,,,,,,,,,,,,,,,,,,,,,,,,,,,,,,,,,,,,,,,,,
Cousas de Carragal,MARÍN. DEFUNCIONES. FALLECIMIENTO DE MARÍA AMADORA MIRAMONTES AGUDO A LOS 55 AÑOS DE EDAD. DEP,https://cousasdecarragal.blogspot.com/2024/10/marin-defunciones-fallecimiento-de.html,2024-10-19T19:30:00,0,,,,,,,,,,,,,,,,,,,,,,,,,,,,,,,,,,,,,,,,,,,,,
Cousas de Carragal,MARÍN. DEFUNCIONES. FALLECIMIENTO DE LA SEÑORA MARÍA LÓPEZ RAMOS A LOS 92 AÑOS DE EDAD. DEP,https://cousasdecarragal.blogspot.com/2024/10/marin-defunciones-fallecimiento-de-la_19.html,2024-10-19T17:31:00,0,,,,,,,,,,,,,,,,,,,,,,,,,,,,,,,,,,,,,,,,,,,,,
Cousas de Carragal,MARÍN. AXENDA GRÁFICA. ¿A DÓNDE IR?,https://cousasdecarragal.blogspot.com/2024/10/marin-axenda-grafica-donde-ir_19.html,2024-10-19T09:45:00,0,,,,,,,,,,,,,,,,,,,,,,,,,,,,,,,,,,,,,,,,,,,,,
Cousas de Carragal,MARÍN. CORRIENDO KILÓMETROS. PERIPLO DE RAQUEL CARRAGAL EN SU LUCHA CONTRA LA ESCLEROSIS MÚLTIPLE,https://cousasdecarragal.blogspot.com/2024/10/marin-corriendo-kilometros-pleriplo-de.html,2024-10-19T07:19:00,0,,,,,,,,,,,,,,,,,,,,,,,,,,,,,,,,,,,,,,,,,,,,,
Cousas de Carragal,"MARÍN,. DEFUNCIONES. FALLECIMIENTO DEL SEÑOR JOSÉ SANTOS MIRANDA A LOS 76 AÑOS DE EDAD. DEP",https://cousasdecarragal.blogspot.com/2024/10/marin-defunciones-fallecimiento-del_17.html,2024-10-17T11:54:00,0,,,,,,,,,,,,,,,,,,,,,,,,,,,,,,,,,,,,,,,,,,,,,
Cousas de Carragal,MARIN. DEFUNCIONES. FALLECIMIENTO DE LA SEÑORA EMERITA RODRÍGUEZ MOLEDO A LOS 91 AÑOS DE EDAD. DEP,https://cousasdecarragal.blogspot.com/2024/10/marin-defunciones-fallecimiento-de-la_17.html,2024-10-17T08:34:00,0,,,,,,,,,,,,,,,,,,,,,,,,,,,,,,,,,,,,,,,,,,,,,
Cousas de Carragal,EL SEMANAL DE CARRAGAL. RESUMEN DE NOTICIAS DESTACADAS.,https://cousasdecarragal.blogspot.com/2024/10/el-semanal-de-carragal-resumen-de.html,2024-10-17T07:49:00,0,,,,,,,,,,,,,,,,,,,,,,,,,,,,,,,,,,,,,,,,,,,,,
Cousas de Carragal,MARÍN. AXENDA GRÁFICA. ¿A DÓNDE IR?,https://cousasdecarragal.blogspot.com/2024/10/maarin-axenda-grafica-donde-ir.html,2024-10-17T07:41:00,0,,,,,,,,,,,,,,,,,,,,,,,,,,,,,,,,,,,,,,,,,,,,,
Cousas de Carragal,MARÍN. CUMPLEAÑOS DEL CORO DE CÁMARA THALASSA. FELICIDADES,https://cousasdecarragal.blogspot.com/2024/10/marin-cumpleanos-del-coro-de-camara.html,2024-10-16T08:39:00,0,,,,,,,,,,,,,,,,,,,,,,,,,,,,,,,,,,,,,,,,,,,,,
Cousas de Carragal,MARIN. DEFUNCIONES. FALLECIMIENTO EN VIGO DEL MARINENSE IVÁN MARTÍNEZ DE SANTIAGO A LOS 67 AÑOS DE EDAD. DEP,https://cousasdecarragal.blogspot.com/2024/10/marin-defunciones-fallecimiento-en-vigo.html,2024-10-13T16:49:00,0,,,,,,,,,,,,,,,,,,,,,,,,,,,,,,,,,,,,,,,,,,,,,
Cousas de Carragal,MARÍN. OTRA VUELTA DE TUERCA. LA DEMOLICIÓN DEL SEXAGENARIO E INACABADO MERCADO DO CANTODAREA,https://cousasdecarragal.blogspot.com/2024/10/marin-otra-vuelta-de-tuerca-la.html,2024-10-13T08:58:00,0,,,,,,,,,,,,,,,,,,,,,,,,,,,,,,,,,,,,,,,,,,,,,
Cousas de Carragal,MARÍN. AXENDA GRÁFICA. ¿A DÓNDE IR?,https://cousasdecarragal.blogspot.com/2024/10/marin-axenda-grafica-donde-ir_12.html,2024-10-12T17:21:00,0,,,,,,,,,,,,,,,,,,,,,,,,,,,,,,,,,,,,,,,,,,,,,
Cousas de Carragal,MARÍN. AGENDA DEL DÍA. PUERTAS ABIERTAS EN LA ENM. CARREIRA POPULAR EN SANTOMÉ. MÚSICA POP-ROCK EN LA ALAMEDA,https://cousasdecarragal.blogspot.com/2024/10/marin-agenda-del-dia-puertas-abiertas.html,2024-10-12T08:18:00,0,,,,,,,,,,,,,,,,,,,,,,,,,,,,,,,,,,,,,,,,,,,,,
Cousas de Carragal,"MARIN. CONTRARRÉPLICA BNG VS. PSOE. LUCIA SANTOS. ""O PORTAVOZ SOCIALISTA DEBE ASUMIR QUE SE EQUIVOCOU...""",https://cousasdecarragal.blogspot.com/2024/10/marin-contrarreplica-bng-vs-psoe-lucia.html,2024-10-11T09:37:00,0,,,,,,,,,,,,,,,,,,,,,,,,,,,,,,,,,,,,,,,,,,,,,
Cousas de Carragal,MARIN. ACTIVIDADES SOLIDARIAS 'NO ESTAMOS SOLOS'. VISIBILIZANDO LAS ENFERMEDADES RARAS.,https://cousasdecarragal.blogspot.com/2024/10/marin-actividades-solidarias-no-estamos.html,2024-10-10T15:42:00,0,,,,,,,,,,,,,,,,,,,,,,,,,,,,,,,,,,,,,,,,,,,,,
Cousas de Carragal,MARÍN. EL SEMANAL DE CARRAGAL. RESUMEN DE NOTICIAS DESTACADAS,https://cousasdecarragal.blogspot.com/2024/10/marin-el-semanal-de-carragal-resumen-de_10.html,2024-10-10T07:37:00,0,,,,,,,,,,,,,,,,,,,,,,,,,,,,,,,,,,,,,,,,,,,,,
Cousas de Carragal,MARIN. DEFUNCIONES. FALLECIMIENTO DEL SEÑOR MANUEL CALVAR LÓPEZ A LOS 71 AÑOS DE EDAD. DEP,https://cousasdecarragal.blogspot.com/2024/10/marin-defunciones-fallecimiento-del_9.html,2024-10-09T08:31:00,0,,,,,,,,,,,,,,,,,,,,,,,,,,,,,,,,,,,,,,,,,,,,,
Cousas de Carragal,MARÍN. RÉPLICA DO PORTAVOZ DO PSOE O BNG SOBRE A COMISIÓN 'PARIPÉ' DE APARCAMENTOS. 'POR DEIXAR AS COUSAS CLARAS'. MANUEL PAZOS LAMOSO,https://cousasdecarragal.blogspot.com/2024/10/marin-replica-do-portavoz-do-psoe-o-bng.html,2024-10-09T08:03:00,0,,,,,,,,,,,,,,,,,,,,,,,,,,,,,,,,,,,,,,,,,,,,,
Cousas de Carragal,MARÍN. DEFUNCIONES. MANUEL JUNCAL CENDÓN (73 AÑOS) Y CÁNDIDO BARCIA FARIÑA (61 AÑOS) DEP,https://cousasdecarragal.blogspot.com/2024/10/marin-defunciones-manuel-juncal-cendon.html,2024-10-09T07:54:00,0,,,,,,,,,,,,,,,,,,,,,,,,,,,,,,,,,,,,,,,,,,,,,
Cousas de Carragal,MARÍN. DEFUNCIONES. FALLECIMIENTO DEL SEÑOR CÁNDIDO 'DUCHI' BARCÍA FARIÑA A LOS 61 AÑOS DE EDAD. DEP,https://cousasdecarragal.blogspot.com/2024/10/marin-defunciones-fallecimiento-del_8.html,2024-10-08T14:30:00,0,,,,,,,,,,,,,,,,,,,,,,,,,,,,,,,,,,,,,,,,,,,,,
Cousas de Carragal,MARIN. AHÍ ESTÁ EL DETALLE. Y DE NUEVO OTRA MARQUESINA. POR ANGEL G. CARRAGAL,https://cousasdecarragal.blogspot.com/2024/10/marin-ahi-esta-el-detalle-y-de-nuevo.html,2024-10-08T08:06:00,0,,,,,,,,,,,,,,,,,,,,,,,,,,,,,,,,,,,,,,,,,,,,,
Cousas de Carragal,MARÍN. DEFUNCIONES. FALLECIMIENTO DE LA SEÑORA ESPERANZA CASTRO BOULLOSA A LA EDAD DE 94 AÑOS. DEP,https://cousasdecarragal.blogspot.com/2024/10/marin-defunciones-fallecimiento-de-la_7.html,2024-10-07T19:28:00,0,,,,,,,,,,,,,,,,,,,,,,,,,,,,,,,,,,,,,,,,,,,,,
Cousas de Carragal,MARÍN. ACLARANDO QUE ES GERUNDIO: O BNG DESMINTE O PSOE EN RELACIÓN Á XUTANZA DE PORTAVOCES SOBRE APARCAMENTO E MOBILIDADE,https://cousasdecarragal.blogspot.com/2024/10/marin-aclarando-que-es-gerundio-o-bng.html,2024-10-07T15:43:00,0,,,,,,,,,,,,,,,,,,,,,,,,,,,,,,,,,,,,,,,,,,,,,
Cousas de Carragal,MARÍN. AXENDA GRÁFICA. ¿A DÓNDE IR?,https://cousasdecarragal.blogspot.com/2024/10/marin-axenda-grafica-donde-ir.html,2024-10-07T08:39:00,0,,,,,,,,,,,,,,,,,,,,,,,,,,,,,,,,,,,,,,,,,,,,,
Cousas de Carragal,"MARIN, EN EL DIA EUROPEO DEL ARTE RUPESTRE. POR ANGEL G. CARRAGAL",https://cousasdecarragal.blogspot.com/2024/10/marin-en-el-dia-europeo-del-arte.html,2024-10-07T08:16:00,0,,,,,,,,,,,,,,,,,,,,,,,,,,,,,,,,,,,,,,,,,,,,,
Cousas de Carragal,"MARÍN. LA ENTREVISTA DEL DOMINGO. HOY: MARIÁN SANMARTÍN, CONCELLEIRA DE CULTURA E FESTAS NOS HABLA SOBRE EL SAMAÍN BRIZ 2024",https://cousasdecarragal.blogspot.com/2024/10/marin-la-entrevista-del-domingo-hoy.html,2024-10-06T08:21:00,0,,,,,,,,,,,,,,,,,,,,,,,,,,,,,,,,,,,,,,,,,,,,,
Cousas de Carragal,MARÍN. DEFUNCIONES. FALLECIMIENTO DE LA SEÑORA MARÍA DEL CARMEN ESPERANZA RIVADULLA CASTRO. DEP,https://cousasdecarragal.blogspot.com/2024/10/marin-defunciones-fallecimiento-de-la.html,2024-10-05T08:54:00,0,,,,,,,,,,,,,,,,,,,,,,,,,,,,,,,,,,,,,,,,,,,,,
Cousas de Carragal,MARÍN. DEFUNCIONES. FALLECIMIENTO DEL SEÑOR ALFREDO RUIBAL SOAGE A LOS 84 AÑOS DE EDAD. DEP,https://cousasdecarragal.blogspot.com/2024/10/marin-defunciones-fallecimiento-del_4.html,2024-10-04T17:30:00,0,,,,,,,,,,,,,,,,,,,,,,,,,,,,,,,,,,,,,,,,,,,,,
Cousas de Carragal,MARIN. EL SEMANAL DE CARRAGAL. POLITICA MUNICIPAL.  RESUMEN DE QUEJAS E INTERPELACIONES DE LA OPOSICIÓN,https://cousasdecarragal.blogspot.com/2024/10/marin-el-semanal-de-carragal-politica.html,2024-10-04T10:01:00,0,,,,,,,,,,,,,,,,,,,,,,,,,,,,,,,,,,,,,,,,,,,,,
Cousas de Carragal,MARÍN. JOSEP BORREL PRONUNCIA HOY UNA CONFERENCIA EN LA CÁTEDRA 'ÁLVAREZ-OSSORIO'. ENM A LAS 18.00H,https://cousasdecarragal.blogspot.com/2024/10/marin-josep-borrel-pronuncia-hoy-una.html,2024-10-04T08:59:00,0,,,,,,,,,,,,,,,,,,,,,,,,,,,,,,,,,,,,,,,,,,,,,
Cousas de Carragal,MARIN. AXENDA GRÁFICA MES DE OCTUBRE. ¿A DÓNDE IR?,https://cousasdecarragal.blogspot.com/2024/10/marin-axenda-grafica-mes-de-octubre.html,2024-10-03T14:27:00,0,,,,,,,,,,,,,,,,,,,,,,,,,,,,,,,,,,,,,,,,,,,,,
Cousas de Carragal,MARÍN. DEFUNCIONES. FALLECIMIENTO DEL SEÑOR MANUEL GARCÍA SOAGE A LOS 85 AÑOS DE EDAD. DEP,https://cousasdecarragal.blogspot.com/2024/10/marin-defunciones-fallecimiento-del_3.html,2024-10-03T13:57:00,0,,,,,,,,,,,,,,,,,,,,,,,,,,,,,,,,,,,,,,,,,,,,,
Cousas de Carragal,MARIN. QUE LA FIESTA NO PARE. SIGUE.. SIGUE... SANTOMÉ DE PIÑEIRO PON EN MARCHA A FESTA DA MAZÁ E DA SIDRA (FIN DE SEMANA DO 4 O 6),https://cousasdecarragal.blogspot.com/2024/10/marin-que-la-fiesta-no-pare-sigue-sigue.html,2024-10-03T09:10:00,0,,,,,,,,,,,,,,,,,,,,,,,,,,,,,,,,,,,,,,,,,,,,,
Cousas de Carragal,MARÍN. EL SEMANAL DE CARRAGAL. RESUMEN DE NOTICIAS DESTACADAS.,https://cousasdecarragal.blogspot.com/2024/10/marin-el-semanal-de-carragal-resumen-de.html,2024-10-03T08:02:00,0,,,,,,,,,,,,,,,,,,,,,,,,,,,,,,,,,,,,,,,,,,,,,
Cousas de Carragal,MARÍN. DEFUNCIONES. FALLECIMIENTO DEL SEÑOR MANUEL FREIRE PÉREZ A LOS 93 AÑOS DE EDAD. DEP,https://cousasdecarragal.blogspot.com/2024/10/marin-defunciones-fallecimiento-del.html,2024-10-02T18:45:00,0,,,,,,,,,,,,,,,,,,,,,,,,,,,,,,,,,,,,,,,,,,,,,
Cousas de Carragal,MARÍN. DEFUNCIONES. FALLECIMIENTO DE LA SEÑORA CELIA PIDRE CALVIÑO A LOS 93 AÑOS DE EDAD. DEP,https://cousasdecarragal.blogspot.com/2024/09/marin-defunciones-fallecimiento-de-la_30.html,2024-09-30T08:50:00,0,,,,,,,,,,,,,,,,,,,,,,,,,,,,,,,,,,,,,,,,,,,,,
Cousas de Carragal,"MARÍN. ANIVERSARIO. 'IN MEMORIAM' AL MAESTRO FRANCISCO LANDIN., POR ANGEL G. CARRAGAL",https://cousasdecarragal.blogspot.com/2024/09/marin-aniversario-in-memoriam-al.html,2024-09-30T08:17:00,0,,,,,,,,,,,,,,,,,,,,,,,,,,,,,,,,,,,,,,,,,,,,,
Cousas de Carragal,MARÍN. SAN MIGUEL. 'A FESTA DO SANTIÑO DE PAU'. POR ANGEL GARCÍA CARRAGAL,https://cousasdecarragal.blogspot.com/2024/09/marin-san-miguel-festa-do-santino-de.html,2024-09-29T08:38:00,0,,,,,,,,,,,,,,,,,,,,,,,,,,,,,,,,,,,,,,,,,,,,,
