source,title,link,date,n_comments,comment_1_author,comment_1_date,comment_1_text,comment_2_author,comment_2_date,comment_2_text,comment_3_author,comment_3_date,comment_3_text,comment_4_author,comment_4_date,comment_4_text,comment_5_author,comment_5_date,comment_5_text,comment_6_author,comment_6_date,comment_6_text,comment_7_author,comment_7_date,comment_7_text,comment_8_author,comment_8_date,comment_8_text,comment_9_author,comment_9_date,comment_9_text,comment_10_author,comment_10_date,comment_10_text,comment_11_author,comment_11_date,comment_11_text,comment_12_author,comment_12_date,comment_12_text,comment_13_author,comment_13_date,comment_13_text,comment_14_author,comment_14_date,comment_14_text,comment_15_author,comment_15_date,comment_15_text
Cousas de Carragal,MARIN. DEFUNCIONES. FALLECIMIENTO DEL SEÑOR SENÉN FONTANES CAMPELO A LOS 90 AÑOS DE EDAD. DEP,https://cousasdecarragal.blogspot.com/2024/04/marin-defunciones-fallecimiento-del_5.html,2024-04-05T08:12:00,0,,,,,,,,,,,,,,,,,,,,,,,,,,,,,,,,,,,,,,,,,,,,,
Cousas de Carragal,MARÍN. EL SEMANAL DE CARRAGAL. RESUMEN DE NOTICIAS DESTACADAS,https://cousasdecarragal.blogspot.com/2024/04/marain-el-semanal-de-carragal-resumen.html,2024-04-04T21:26:00,0,,,,,,,,,,,,,,,,,,,,,,,,,,,,,,,,,,,,,,,,,,,,,
Cousas de Carragal,MARÍN. DEFUNCIONES. FALLECIMIENTO DE DORINDA GARCÍA GONZÁLEZ A LOS 89 AÑOS DE EDAD. DEP,https://cousasdecarragal.blogspot.com/2024/04/marin-defunciones-fallecimiento-de_4.html,2024-04-04T08:55:00,0,,,,,,,,,,,,,,,,,,,,,,,,,,,,,,,,,,,,,,,,,,,,,
Cousas de Carragal,MARÍN. DEFUNCIONES. DEL DÍA. FALLECIMIENTO DE JESÚS MANUEL PASTORIZA LORENZO A LOS 53 AÑOS DE EDAD. DEP,https://cousasdecarragal.blogspot.com/2024/04/marain-defunciones-del-dia.html,2024-04-02T08:54:00,0,,,,,,,,,,,,,,,,,,,,,,,,,,,,,,,,,,,,,,,,,,,,,
Cousas de Carragal,MARÍN. DEFUNCIONES. FALLECIMIENTO DE JESÚS ÁNGEL GARCÍA SOAGE A LOS 54 AÑOS DE EDAD. DEP,https://cousasdecarragal.blogspot.com/2024/04/marin-defunciones-fallecimiento-de.html,2024-04-01T15:12:00,0,,,,,,,,,,,,,,,,,,,,,,,,,,,,,,,,,,,,,,,,,,,,,
Cousas de Carragal,MARÍN. CUANDO EL RECTIFICAR ES DE SABIOS. POR ANGEL G. CARRAGAL,https://cousasdecarragal.blogspot.com/2024/04/marin-cuando-el-rectificar-es-de-sabios.html,2024-04-01T08:39:00,0,,,,,,,,,,,,,,,,,,,,,,,,,,,,,,,,,,,,,,,,,,,,,
Cousas de Carragal,MARIN. DEFUNCIONES. FALLECIMIENTO DEL SEÑOR JOSÉ OTERO CRUCES A LOS 75 AÑOS DE EDAD. DEP,https://cousasdecarragal.blogspot.com/2024/04/marin-defunciones-fallecimiento-del.html,2024-04-01T08:27:00,0,,,,,,,,,,,,,,,,,,,,,,,,,,,,,,,,,,,,,,,,,,,,,
Cousas de Carragal,MARÍN. CRÓNICAS CENTENARIAS. SEMANA SANTA 1913. 'XA CHOVEU',https://cousasdecarragal.blogspot.com/2024/03/marin-cronicas-centenarias-semana-santa_30.html,2024-03-30T10:59:00,0,,,,,,,,,,,,,,,,,,,,,,,,,,,,,,,,,,,,,,,,,,,,,
Cousas de Carragal,MARÍN. EL SEMANAL DE CARRAGAL. RESUMEN DE NOTICIAS DESTACADAS,https://cousasdecarragal.blogspot.com/2024/03/marin-el-semanal-de-carragal-resumen-de.html,2024-03-29T08:04:00,0,,,,,,,,,,,,,,,,,,,,,,,,,,,,,,,,,,,,,,,,,,,,,
Cousas de Carragal,MARÍN. DEFUNCIONES. FALLECIMIENTO DE LA SEÑORA ROSA SANTIAGO FRESCO A LOS 90 AÑOS DE EDAD. DEP,https://cousasdecarragal.blogspot.com/2024/03/marin-defunciones-fallecimiento-de-la_28.html,2024-03-28T18:21:00,0,,,,,,,,,,,,,,,,,,,,,,,,,,,,,,,,,,,,,,,,,,,,,
Cousas de Carragal,"MARÍN, 28 DE MARZO DE 2024. JUEVES SANTO. EL SEMANAL DE CARRAGAL RESUMEN DE NOTICIAS DESTACADAS.",https://cousasdecarragal.blogspot.com/2024/03/marin-28-de-marzo-de-2024-jueves-santo.html,2024-03-28T16:51:00,0,,,,,,,,,,,,,,,,,,,,,,,,,,,,,,,,,,,,,,,,,,,,,
Cousas de Carragal,MARÍN. DEFUNCIONES. FALLECIMIENTO DE EVARISTO CALVAR (64 AÑOS) Y JOSÉ CABALEIRO (88 AÑOS). DEP,https://cousasdecarragal.blogspot.com/2024/03/marin-defunciones-fallecimiento-de_28.html,2024-03-28T07:45:00,0,,,,,,,,,,,,,,,,,,,,,,,,,,,,,,,,,,,,,,,,,,,,,
Cousas de Carragal,"MARÍN,. DEFUNCIONES. FALLECIMIENTO DE EUGENIO 'TITO O PANADEIRO' GÓMEZ (81 AÑOS) Y JOSÉ CASTRO (EL PRIORATO) (93 AÑOS)",https://cousasdecarragal.blogspot.com/2024/03/marin-defunciones-fallecimiento-de.html,2024-03-27T09:04:00,0,,,,,,,,,,,,,,,,,,,,,,,,,,,,,,,,,,,,,,,,,,,,,
Cousas de Carragal,"MARÍN, CUMPLEAÑOS DE FRIGORIFICOS SAFRICOPE. POR ANGEL G. CARRAGAL",https://cousasdecarragal.blogspot.com/2024/03/marin-cumpleanos-de-frigorificos.html,2024-03-25T08:02:00,0,,,,,,,,,,,,,,,,,,,,,,,,,,,,,,,,,,,,,,,,,,,,,
Cousas de Carragal,MARÍN INICIA HOY LA SEMANA SANTA CON LA BENDICIÓN DE RAMOS Y PALMAS EN LA PRAZA DO RELOXO,https://cousasdecarragal.blogspot.com/2024/03/marin-inicia-hoy-la-semana-santa-con-la.html,2024-03-24T08:41:00,0,,,,,,,,,,,,,,,,,,,,,,,,,,,,,,,,,,,,,,,,,,,,,
Cousas de Carragal,FALEMOS DO CASO DE FORMA OBXECTIVA. ¿A QUÉ CHEIRA A FLOR DOS PERAIS ORNAMENTAIS QUE INVADEN MARÍN?.,https://cousasdecarragal.blogspot.com/2024/03/falemos-do-caso-de-forma-obxectiva-que.html,2024-03-24T07:40:00,0,,,,,,,,,,,,,,,,,,,,,,,,,,,,,,,,,,,,,,,,,,,,,
Cousas de Carragal,MARIN. DEFUNCIONES. FALLECIMIENTO DE LA SEÑORA JOSEFA GARCÍA MURADAS A LOS 95 AÑOS DE EDAD. DEP,https://cousasdecarragal.blogspot.com/2024/03/marin-defunciones-fallecimiento-de-la_22.html,2024-03-22T08:50:00,0,,,,,,,,,,,,,,,,,,,,,,,,,,,,,,,,,,,,,,,,,,,,,
Cousas de Carragal,MARÍN. PROGRAMACIÒN DEL DÍA MUNDIAL DE LA POESÍA,https://cousasdecarragal.blogspot.com/2024/03/marin-programacion-del-dia-mundial-de.html,2024-03-21T10:38:00,0,,,,,,,,,,,,,,,,,,,,,,,,,,,,,,,,,,,,,,,,,,,,,
Cousas de Carragal,"MARÍN, JUEVES, 21 DE MARZO DE 2024. EL SEMANAL DE CARRAGAL. RESUMEN DE NOTICIAS DESTACADAS. BUENOS DÍAS / BOS DÍAS",https://cousasdecarragal.blogspot.com/2024/03/marin-jueves-21-de-marzo-de-2024-el.html,2024-03-21T09:40:00,0,,,,,,,,,,,,,,,,,,,,,,,,,,,,,,,,,,,,,,,,,,,,,
Cousas de Carragal,MARÍN. EN EL DÍA MUNDIAL DE LA POESÍA. POR ANGEL G. CARRAGAL,https://cousasdecarragal.blogspot.com/2024/03/marin-en-el-dia-mundial-de-la-poesia.html,2024-03-18T08:15:00,0,,,,,,,,,,,,,,,,,,,,,,,,,,,,,,,,,,,,,,,,,,,,,
Cousas de Carragal,MARÍN DEFUNCIONES. FALLECIMIENTO DE EUSEBIO GONZÁLEZ CERQUEIRO Y JOSÉ JAVIER ROSALES MILLÁN. DEP,https://cousasdecarragal.blogspot.com/2024/03/marin-defuinciones-fallecimiento-de.html,2024-03-18T08:06:00,0,,,,,,,,,,,,,,,,,,,,,,,,,,,,,,,,,,,,,,,,,,,,,
Cousas de Carragal,MARÍN. PROPUESTA DE COMPRA DEL EDIFICIO BALADRÓN. LA CRÓNICA DE UN 'NO'  ANUNCIADO. POR ANGEL G. CARRAGAL,https://cousasdecarragal.blogspot.com/2024/03/marin-propuesta-de-compra-del-edificio.html,2024-03-15T08:52:00,0,,,,,,,,,,,,,,,,,,,,,,,,,,,,,,,,,,,,,,,,,,,,,
Cousas de Carragal,MARÍN. DEFUNCIONES. FALLECIMIENTO DE LA SEÑORA OTILIA PARADA TORRES 'A CASQUEIRA' A LOS 98 AÑOS DE EDAD. DEP,https://cousasdecarragal.blogspot.com/2024/03/marin-defunciones-fallecimiento-de-la_32.html,2024-03-14T12:15:00,0,,,,,,,,,,,,,,,,,,,,,,,,,,,,,,,,,,,,,,,,,,,,,
Cousas de Carragal,"MARÍN, 14 DE MARZO DE 2024. EL SEMANAL DE CARRAGAL. RESUMEN DE NOTICIAS DESTACADAS.",https://cousasdecarragal.blogspot.com/2024/03/marin-14-de-marzo-de-2024-el-semanal-de.html,2024-03-14T08:52:00,0,,,,,,,,,,,,,,,,,,,,,,,,,,,,,,,,,,,,,,,,,,,,,
Cousas de Carragal,MARIN. DEFUNCIONES DEL DÍA. FALLECIMIENTO DEL SEÑOR ANDRÉS LOIRA CIDRÁS A LOS 63 AÑOS DE EDAD. DEP,https://cousasdecarragal.blogspot.com/2024/03/marin-defunciones-del-dia-fallecimiento.html,2024-03-13T10:56:00,0,,,,,,,,,,,,,,,,,,,,,,,,,,,,,,,,,,,,,,,,,,,,,
Cousas de Carragal,MARÍN. O DÍA MUNDIAL DA POESÍA ATOPA ESPACIO CONMEMORATIVO NO CLUB DE OPINION 'PORTOCELO',https://cousasdecarragal.blogspot.com/2024/03/marin-el-dia-mundial-de-la-poesia.html,2024-03-12T09:15:00,0,,,,,,,,,,,,,,,,,,,,,,,,,,,,,,,,,,,,,,,,,,,,,
Cousas de Carragal,MARÍN. DEFUNCIONES. FALLECIMIENTO DEL PROFESOR D. FRANCISCO F. MORALES SANTIAGO A LOS 94 AÑOS DE EDAD. DEP,https://cousasdecarragal.blogspot.com/2024/03/marin-defunciones-fallecimiento-del_12.html,2024-03-12T08:42:00,0,,,,,,,,,,,,,,,,,,,,,,,,,,,,,,,,,,,,,,,,,,,,,
Cousas de Carragal,MARÍN. DÍA MUNDIAL DE LA TORTILLA DE PATATAS. CON O SIN CEBOLLA. POR ANGEL G. CARRAGAL,https://cousasdecarragal.blogspot.com/2024/03/marin-dia-mundial-de-la-tortilla-de.html,2024-03-11T08:12:00,0,,,,,,,,,,,,,,,,,,,,,,,,,,,,,,,,,,,,,,,,,,,,,
Cousas de Carragal,MARÍN. DEFUNCIONES. FALLECIMIENTO DEL SEÑOR BENITO CERVIÑO VALERO A LOS 54 AÑOS DE EDAD. DEP,https://cousasdecarragal.blogspot.com/2024/03/marin-defunciones-fallecimiento-del_8.html,2024-03-08T16:44:00,0,,,,,,,,,,,,,,,,,,,,,,,,,,,,,,,,,,,,,,,,,,,,,
Cousas de Carragal,MARÍN. NO DÍA DA MULLER. SEGUIMOS CON TODAS E PARA TODAS CON +IGUALDADE. POR MARÍA RAMALLO VÁZQUEZ. ALCALDESA DE MARÍN,https://cousasdecarragal.blogspot.com/2024/03/marin-no-dia-da-muller-seguimos-con.html,2024-03-08T08:46:00,0,,,,,,,,,,,,,,,,,,,,,,,,,,,,,,,,,,,,,,,,,,,,,
Cousas de Carragal,"MARÍN, 07 DE MARZO DE 2024. EL SEMANAL DE CARRAGAL. RESUMEN DE LAS NOTICIAS DESTACADAS",https://cousasdecarragal.blogspot.com/2024/03/marin-07-de-marzo-de-2024-el-semanal-de.html,2024-03-07T09:19:00,0,,,,,,,,,,,,,,,,,,,,,,,,,,,,,,,,,,,,,,,,,,,,,
Cousas de Carragal,MARÍN. DEFUNCIONES. FALLECIMIENTO DEL SEÑOR JOSÉ MIGUEL PAZOS SOTO A LOS 55 AÑOS DE EDAD,https://cousasdecarragal.blogspot.com/2024/03/marin-defunciones-fallecimiento-del.html,2024-03-06T08:34:00,0,,,,,,,,,,,,,,,,,,,,,,,,,,,,,,,,,,,,,,,,,,,,,
Cousas de Carragal,"MARÍN, VA SIENDO HORA DE HABLAR CON DEFENSA. POR ANGEL G. CARRAGAL",https://cousasdecarragal.blogspot.com/2024/03/marin-va-siendo-hora-de-hablar-con.html,2024-03-04T08:19:00,0,,,,,,,,,,,,,,,,,,,,,,,,,,,,,,,,,,,,,,,,,,,,,
Cousas de Carragal,MARÍN. DEFUNCIONES. FALLECIMIENTO DE LA SEÑORA CONSUELO VEIGA NOVEGIL A LOS 93 AÑOS DE EDAD,https://cousasdecarragal.blogspot.com/2024/03/marin-defunciones-fallecimiento-de-la.html,2024-03-03T08:47:00,0,,,,,,,,,,,,,,,,,,,,,,,,,,,,,,,,,,,,,,,,,,,,,
Cousas de Carragal,MARÍN. DEFUNCIONES. FALLECIMIENTO DE LA SEÑORA MARÍA DEL RÍO PEQUEÑO A LOS 94 AÑOS DE EDAD. DEP,https://cousasdecarragal.blogspot.com/2024/02/marin-defunciones-fallecimiento-de-la_29.html,2024-02-29T12:11:00,0,,,,,,,,,,,,,,,,,,,,,,,,,,,,,,,,,,,,,,,,,,,,,
Cousas de Carragal,"MARÍN, JUEVES, 29 DE FEBRERO DE 2024. EL SEMANAL DE CARRAGAL. RESUMEN DE NOTICIAS DESTACADAS",https://cousasdecarragal.blogspot.com/2024/02/marin-jueves-29-de-febrero-de-2024-el.html,2024-02-29T08:15:00,0,,,,,,,,,,,,,,,,,,,,,,,,,,,,,,,,,,,,,,,,,,,,,
Cousas de Carragal,MARÍN. DEFUNCIONES. FALLECIMIENTO DE LA SEÑORA ELVIRA CASTRO BOULLOSA A LOS 91 AÑOS DE EDAD. DEP,https://cousasdecarragal.blogspot.com/2024/02/marin-defunciones-fallecimiento-de-la_28.html,2024-02-28T08:46:00,0,,,,,,,,,,,,,,,,,,,,,,,,,,,,,,,,,,,,,,,,,,,,,
Cousas de Carragal,MARÍN. DEFUNCIONES. FALLECIMIENTO DE LA SEÑORA CENTENARIA JOSEFA PÉREZ DOPAZO A LOS 100 AÑOS DE EDAD. DEP,https://cousasdecarragal.blogspot.com/2024/02/marin-defunciones-fallecimiento-de-la_26.html,2024-02-26T18:36:00,0,,,,,,,,,,,,,,,,,,,,,,,,,,,,,,,,,,,,,,,,,,,,,
Cousas de Carragal,"MARÍN, CARME ADÁN EN EL DÍA DE ROSALÍA. POR ANGEL G. CARRAGAL",https://cousasdecarragal.blogspot.com/2024/02/marin-carmen-adan-en-el-dia-de-rosalia.html,2024-02-26T07:45:00,0,,,,,,,,,,,,,,,,,,,,,,,,,,,,,,,,,,,,,,,,,,,,,
Cousas de Carragal,MARÍN. DEFUNCIONES. FALLECIMIENTO DEL SEÑOR PEDRO PARDAVILA DE LOS SANTOS A LOS 91 AÑOS DE EDAD. DEP,https://cousasdecarragal.blogspot.com/2024/02/marin-defunciones-fallecimiento-del_24.html,2024-02-24T21:14:00,0,,,,,,,,,,,,,,,,,,,,,,,,,,,,,,,,,,,,,,,,,,,,,
Cousas de Carragal,MARÍN. EL SEMANAL DE CARRAGAL. RESUMEN DE LAS NOTICIAS DESTACADAS.,https://cousasdecarragal.blogspot.com/2024/02/marin-el-semanal-de-carragal-resumen-de.html,2024-02-22T09:56:00,0,,,,,,,,,,,,,,,,,,,,,,,,,,,,,,,,,,,,,,,,,,,,,
Cousas de Carragal,"MARÍN. LA REGENERACIÓN DEL LAGO DE CASTIÑEIRAS, VA 'PA LARGO'. POR ANGEL G. CARRAGAL",https://cousasdecarragal.blogspot.com/2024/02/marin-la-regeneracion-del-lago-de.html,2024-02-20T08:48:00,0,,,,,,,,,,,,,,,,,,,,,,,,,,,,,,,,,,,,,,,,,,,,,
Cousas de Carragal,"MARÍN, DEFUNCIONES. FALLECIMIENTO DE MANUEL PIÑEIRO (100 AÑOS), PURIFICACIÓN LACUEVA (73 AÑOS) Y DOLORES PEREIRA (87 AÑOS)",https://cousasdecarragal.blogspot.com/2024/02/marin-defunciones-fallecimiento-de_18.html,2024-02-18T08:33:00,0,,,,,,,,,,,,,,,,,,,,,,,,,,,,,,,,,,,,,,,,,,,,,
Cousas de Carragal,MARÍN. DEFUNCIONES. FALLECIMIENTO DE LA SEÑORA PURIFICACIÓN LACUEVA FERNÁNDEZ A LOS 73 AÑOS DE EDAD. DEP,https://cousasdecarragal.blogspot.com/2024/02/marin-defunciones-fallecimiento-de-la_17.html,2024-02-17T15:14:00,0,,,,,,,,,,,,,,,,,,,,,,,,,,,,,,,,,,,,,,,,,,,,,
Cousas de Carragal,MARÍN. EL SEMANAL DE CARRAGAL. RESUMEN DE NOTICIAS DESTACADAS,https://cousasdecarragal.blogspot.com/2024/02/marin-el-semana-de-carragal-resumen-de.html,2024-02-15T09:31:00,0,,,,,,,,,,,,,,,,,,,,,,,,,,,,,,,,,,,,,,,,,,,,,
Cousas de Carragal,"MARÍN. SAN VALENTÍN, CUARESMA, MIÉRCOLES DE CENIZA Y 'ENTERRO DA SARDIÑA'. FELIZ DÍA",https://cousasdecarragal.blogspot.com/2024/02/marin-san-valentin-cuaresma-miercoles.html,2024-02-14T08:15:00,0,,,,,,,,,,,,,,,,,,,,,,,,,,,,,,,,,,,,,,,,,,,,,
Cousas de Carragal,"MARÍN. DEFUNCIONES. FUNERALES POR CARMEN GONZÁLEZ, ANTONIO GARRIDO Y CARMEN VILLANUEVA. DEP",https://cousasdecarragal.blogspot.com/2024/02/marin-defunciones-funerales-por-carmen.html,2024-02-12T08:42:00,0,,,,,,,,,,,,,,,,,,,,,,,,,,,,,,,,,,,,,,,,,,,,,
Cousas de Carragal,MARÍN. 'O ENTERRO DA SARDIÑA' LUCIÓ TRADICIÓN EN FITUR. POR ANGEL G. CARRAGAL,https://cousasdecarragal.blogspot.com/2024/02/marin-o-enterro-da-sardina-lucio.html,2024-02-12T08:02:00,0,,,,,,,,,,,,,,,,,,,,,,,,,,,,,,,,,,,,,,,,,,,,,
Cousas de Carragal,MARIN. FELIZ CARNAVAL. PROGRAMA DEL ENTROIDO MARIN 24,https://cousasdecarragal.blogspot.com/2024/02/marin-feliz-carnaval-programa-del.html,2024-02-11T10:01:00,0,,,,,,,,,,,,,,,,,,,,,,,,,,,,,,,,,,,,,,,,,,,,,
Cousas de Carragal,MARÍN. DEFUNCIONES. FALLECIMIENTOS. MANUEL SANTOS JUNCAL. ANTONIO GARRIDO GARCIA. ANTONIO REY PARATCHA Y CARMEN VILLANUEVA AQUINO. DEP,https://cousasdecarragal.blogspot.com/2024/02/marin-defunciones-fallecimientos-manuel.html,2024-02-11T09:46:00,0,,,,,,,,,,,,,,,,,,,,,,,,,,,,,,,,,,,,,,,,,,,,,
Cousas de Carragal,MARÍN. DEFUNCIONES. FALLECIMIENTO DEL SEÑOR MANUEL SANTOS JUNCAL A LA EDAD DE 85 AÑOS,https://cousasdecarragal.blogspot.com/2024/02/marin-defunciones-fallecimiento-del_10.html,2024-02-10T19:58:00,0,,,,,,,,,,,,,,,,,,,,,,,,,,,,,,,,,,,,,,,,,,,,,
Cousas de Carragal,MARÍN. DEFUNCIONES. FALLECIMIENTO DEL SEÑOR ANTONIO GARRIDO GARCÍA (FILLO DE ASO) A LOS 92 AÑOS DE EDAD. DEP,https://cousasdecarragal.blogspot.com/2024/02/marin-defunciones-fallecimiento-del.html,2024-02-10T13:38:00,0,,,,,,,,,,,,,,,,,,,,,,,,,,,,,,,,,,,,,,,,,,,,,
Cousas de Carragal,MARIN. AVISO IMPORTANTE. LA LLUVIA OBLIGA A CAMBIOS EN EL PROGRAMA DEL CARNAVAL,https://cousasdecarragal.blogspot.com/2024/02/marin-aviso-importante-la-lluvia-obliga.html,2024-02-09T14:46:00,0,,,,,,,,,,,,,,,,,,,,,,,,,,,,,,,,,,,,,,,,,,,,,
Cousas de Carragal,MARÍN. EL CARNAVAL DA COMIENZO CON CÁNTICOS DE TABERNA.,https://cousasdecarragal.blogspot.com/2024/02/marin-el-carnaval-da-comienzo-con.html,2024-02-09T08:31:00,0,,,,,,,,,,,,,,,,,,,,,,,,,,,,,,,,,,,,,,,,,,,,,
Cousas de Carragal,"MARIN, 8 DE FEBRERO DE 2024.  EL SEMANAL DE CARRAGAL. RESUMEN DE NOTICIAS DESTACADAS",https://cousasdecarragal.blogspot.com/2024/02/marin-8-de-febrero-de-2024-el-semanal.html,2024-02-08T10:40:00,0,,,,,,,,,,,,,,,,,,,,,,,,,,,,,,,,,,,,,,,,,,,,,
Cousas de Carragal,MARÍN. DEFUNCIONES. FALLECIMIENTO DE LA SEÑORA PERFECTA TORRES ESTÉVEZ A LOS 90 AÑOS DE EDAD. DEP,https://cousasdecarragal.blogspot.com/2024/02/marin-defunciones-fallecimiento-de-la.html,2024-02-03T08:31:00,0,,,,,,,,,,,,,,,,,,,,,,,,,,,,,,,,,,,,,,,,,,,,,
Cousas de Carragal,MARIN. AGUETE Y SEIXO CELEBRAN HOY EL DÍA DE SAN BLAS,https://cousasdecarragal.blogspot.com/2024/02/marin-aguete-y-seixo-celebran-hoy-el.html,2024-02-03T08:14:00,0,,,,,,,,,,,,,,,,,,,,,,,,,,,,,,,,,,,,,,,,,,,,,
Cousas de Carragal,MARÍN AXENDA. A CARREIRA DO TRUCO E AS ACTIVIDADES PREPARATORIAS 'DO ENTROIDO' NO ATENEO,https://cousasdecarragal.blogspot.com/2024/02/marin-axenda-la-carreira-do-truco-y.html,2024-02-02T09:11:00,0,,,,,,,,,,,,,,,,,,,,,,,,,,,,,,,,,,,,,,,,,,,,,
Cousas de Carragal,"MARÍN, JUEVES 1 DE FEBRERO DE 2024.  EL SEMANAL DE CARRAGAL. RESUMEN DE NOTICIAS DESTACADAS",https://cousasdecarragal.blogspot.com/2024/02/marin-jueves-1-de-febrero-de-2024-el.html,2024-02-01T09:15:00,0,,,,,,,,,,,,,,,,,,,,,,,,,,,,,,,,,,,,,,,,,,,,,
Cousas de Carragal,MARÍN. DEFUNCIONES. FALLECIMIENTO DE JULIÁN GARCÍA FREIRÍA A LOS 47 AÑOS DE EDAD. DEP,https://cousasdecarragal.blogspot.com/2024/02/marin-defunciones-fallecimiento-de.html,2024-02-01T07:41:00,0,,,,,,,,,,,,,,,,,,,,,,,,,,,,,,,,,,,,,,,,,,,,,
Cousas de Carragal,MARÍN. DEFUNCIONES. FALLECIMIENTO DE LA SEÑORA JOSEFA AREA MOREIRA A LOS 94 AÑOS DE EDAD. DEP,https://cousasdecarragal.blogspot.com/2024/01/marin-defunciones-fallecimiento-de-la_26.html,2024-01-29T15:57:00,0,,,,,,,,,,,,,,,,,,,,,,,,,,,,,,,,,,,,,,,,,,,,,
Cousas de Carragal,MARÍN. EN EL MES DE DANIEL R. CASTELAO. POR ANGEL G. CARRAGAL,https://cousasdecarragal.blogspot.com/2024/01/marin-en-el-mes-de-daniel-r-castelao.html,2024-01-29T08:06:00,0,,,,,,,,,,,,,,,,,,,,,,,,,,,,,,,,,,,,,,,,,,,,,
Cousas de Carragal,MARIN. DEFUNCIONES. FALLECIMIENTO DE LA SEÑORA EDELMIRA PIDRE CALVIÑO A LOS 88 AÑOS DE EDAD. DEP,https://cousasdecarragal.blogspot.com/2024/01/marin-defunciones-fallecimiento-de-la_29.html,2024-01-29T08:00:00,0,,,,,,,,,,,,,,,,,,,,,,,,,,,,,,,,,,,,,,,,,,,,,
Cousas de Carragal,MARÍN. DEFUNCIONES. FALLECIMIENTO DE EMILIO SANJORGE FERNÁNDEZ A LOS 63 AÑOS DE EDAD. DEP,https://cousasdecarragal.blogspot.com/2024/01/marin-defunciones-fallecimiento-de_26.html,2024-01-26T08:36:00,0,,,,,,,,,,,,,,,,,,,,,,,,,,,,,,,,,,,,,,,,,,,,,
Cousas de Carragal,MARÍN. O SEMANAL DE CARRAGAL. RESUMEN DE NOTICIAS DESTACADAS,https://cousasdecarragal.blogspot.com/2024/01/marin-o-semanal-de-carragal-resumen-de.html,2024-01-25T10:00:00,0,,,,,,,,,,,,,,,,,,,,,,,,,,,,,,,,,,,,,,,,,,,,,
Cousas de Carragal,MARIN. EL MAL LLAMADO 'CRUCEIRO DAS CINCO CALLES' POR ANGEL G. CARRAGAL,https://cousasdecarragal.blogspot.com/2024/01/marin-el-mal-llamado-cruceiro-das-cinco.html,2024-01-22T08:46:00,0,,,,,,,,,,,,,,,,,,,,,,,,,,,,,,,,,,,,,,,,,,,,,
Cousas de Carragal,MARIN. DEFUNCIONES. FALLECIMIENTO DE MARÍA DEL CARMEN CASTIÑEIRAS SANMARTÍN A LOS 83 AÑOS DE EDAD. DEP,https://cousasdecarragal.blogspot.com/2024/01/marin-defunciones-fallecimiento-de_20.html,2024-01-20T09:53:00,0,,,,,,,,,,,,,,,,,,,,,,,,,,,,,,,,,,,,,,,,,,,,,
Cousas de Carragal,MARIN. EL SEMANAL DE CARRAGAL. RESUMEN DE NOTICIAS DESTACADAS,https://cousasdecarragal.blogspot.com/2024/01/marin-el-semanal-de-carragal-resumen-de_18.html,2024-01-18T10:31:00,0,,,,,,,,,,,,,,,,,,,,,,,,,,,,,,,,,,,,,,,,,,,,,
Cousas de Carragal,MARÍN. LAS CANCHAS DE PETANCA PROMETIDAS. POR ANGEL G. CARRAGAL,https://cousasdecarragal.blogspot.com/2024/01/marin-las-cangas-de-petanca-prometidas.html,2024-01-15T08:52:00,0,,,,,,,,,,,,,,,,,,,,,,,,,,,,,,,,,,,,,,,,,,,,,
Cousas de Carragal,MARÍN. ¿A DÓNDE IR? . FIN DE SEMANA. STOCK MARIN Y FESTA DO TORRESMO EN ARDÁN,https://cousasdecarragal.blogspot.com/2024/01/marin-donde-ir-fin-de-semana-stock.html,2024-01-13T09:40:00,0,,,,,,,,,,,,,,,,,,,,,,,,,,,,,,,,,,,,,,,,,,,,,
Cousas de Carragal,MARÍN. EL SEMANAL DE CARRAGAL. RESUMEN DE NOTICIAS DESTACADAS,https://cousasdecarragal.blogspot.com/2024/01/marin-el-semanal-de-carragal-resumen-de_11.html,2024-01-11T10:14:00,0,,,,,,,,,,,,,,,,,,,,,,,,,,,,,,,,,,,,,,,,,,,,,
Cousas de Carragal,MARÍN. DEFUNCIONES. FALLECIMIENTO DEL SEÑOR DOMINGO OTERO CAPELO A LOS 78 AÑOS DE EDAD. DEP,https://cousasdecarragal.blogspot.com/2024/01/marin-defunciones-fallecimiento-del.html,2024-01-10T08:42:00,0,,,,,,,,,,,,,,,,,,,,,,,,,,,,,,,,,,,,,,,,,,,,,
Cousas de Carragal,MARÍN. EL PARKING SUBTERRÁNEO 'VA PA LARGO'. POR ANGEL G. CARRAGAL,https://cousasdecarragal.blogspot.com/2024/01/marin-el-parking-subterraneo-va-pa.html,2024-01-08T07:51:00,0,,,,,,,,,,,,,,,,,,,,,,,,,,,,,,,,,,,,,,,,,,,,,
Cousas de Carragal,MARÍN. LA PARROQUIA DE SAN XULIÁN CELEBRA HOY LA FESTIVIDAD DE SU SANTO PATRÓN. FELICIDADES,https://cousasdecarragal.blogspot.com/2024/01/marin-la-parroquia-de-san-xulian.html,2024-01-07T08:48:00,0,,,,,,,,,,,,,,,,,,,,,,,,,,,,,,,,,,,,,,,,,,,,,
Cousas de Carragal,MARÍN. DEFUNCIONES. FALLECIMIENTO DE LA SEÑORA PURIFICACIÓN SEIJO (79 AÑOS) Y JOSÉ MANUEL GARCÍA (87 AÑOS). DEP,https://cousasdecarragal.blogspot.com/2024/01/marin-defunciones-fallecimiento-de-la.html,2024-01-06T08:42:00,0,,,,,,,,,,,,,,,,,,,,,,,,,,,,,,,,,,,,,,,,,,,,,
Cousas de Carragal,MARÍN. DEFUNCIONES. ÚLTIMA HORA. FALLECIMIENTO DEL SEÑOR JOSÉ MANUEL GARCIA FERREIRA A LOS 87 AÑOS DE EDAD. DEP,https://cousasdecarragal.blogspot.com/2024/01/marin-defunciones-ultima-hora.html,2024-01-05T19:57:00,0,,,,,,,,,,,,,,,,,,,,,,,,,,,,,,,,,,,,,,,,,,,,,
Cousas de Carragal,MARIN. DEFUNCIONES DEL DÍA. FALLECIMIENTO DE PURIFICACIÓN SEIJO DOMINGUIEZ (PURI A CHAMBRICAS) A LOS 79 AÑOS DE EDAD. DEP,https://cousasdecarragal.blogspot.com/2024/01/marin-defunciones-del-dia-fallecimiento_5.html,2024-01-05T12:50:00,0,,,,,,,,,,,,,,,,,,,,,,,,,,,,,,,,,,,,,,,,,,,,,
Cousas de Carragal,LA MAGIA DE LOS REYES DE ORIENTE INUNDARÁ HOY LAS CALLES DE MARÍN,https://cousasdecarragal.blogspot.com/2024/01/la-magia-de-los-reyes-de-oriente.html,2024-01-05T08:21:00,0,,,,,,,,,,,,,,,,,,,,,,,,,,,,,,,,,,,,,,,,,,,,,
Cousas de Carragal,MARÍN. DEFUNCIONES. FALLECIMIENTOS DE ARTURO ACUÑA IGLESIAS (87 AÑOS) Y MANUEL CASTRO RODRÍGUEZ (87 AÑOS). DEP,https://cousasdecarragal.blogspot.com/2024/01/marin-defunciones-fallecimientos-de.html,2024-01-05T07:58:00,0,,,,,,,,,,,,,,,,,,,,,,,,,,,,,,,,,,,,,,,,,,,,,
Cousas de Carragal,"MARÍN. DEFUNCIONES DEL DÍA. FALLECIMIENTO DE SEBASTIÁN FERNÁNDEZ  (O PANCHITO), ARTURO ACUÑA (PALLEIRO) Y MANUEL CASTRO (O DE LISA)",https://cousasdecarragal.blogspot.com/2024/01/marin-defunciones-del-dia-fallecimiento.html,2024-01-04T08:05:00,0,,,,,,,,,,,,,,,,,,,,,,,,,,,,,,,,,,,,,,,,,,,,,
Cousas de Carragal,MARÍN. EL SEMANAL DE CARRAGAL. RESUMEN DE NOTICIAS DESTACADAS,https://cousasdecarragal.blogspot.com/2024/01/marin-el-semanal-de-carragal-resumen-de.html,2024-01-04T07:50:00,0,,,,,,,,,,,,,,,,,,,,,,,,,,,,,,,,,,,,,,,,,,,,,
Cousas de Carragal,MARÍN. DEFUNCIONES. FALLECIMIENTO DE SEBASTIÁN FERNÁNDEZ LÓPEZ (O PANCHITO) A LOS 60 AÑOS DE EDAD.,https://cousasdecarragal.blogspot.com/2024/01/marin-defunciones-fallecimiento-de.html,2024-01-03T16:59:00,0,,,,,,,,,,,,,,,,,,,,,,,,,,,,,,,,,,,,,,,,,,,,,
Cousas de Carragal,MARÍN. EL 'SÍ ES SÍ'   A LAS PISCINAS DE AGUA SALADA. POR ANGEL G. CARRAGAL,https://cousasdecarragal.blogspot.com/2024/01/marin-el-si-es-si-las-piscinas-de-agua.html,2024-01-02T07:57:00,0,,,,,,,,,,,,,,,,,,,,,,,,,,,,,,,,,,,,,,,,,,,,,
Cousas de Carragal,MARÍN. DEFUNCIONES. FALLECIMIENTO DE JOSÉ CARLOS CARABELOS PÉREZ (CHALS) A LOS 61 AÑOS DE EDAD. DEP,https://cousasdecarragal.blogspot.com/2023/12/marin-defunciones-fallecimiento-de-jose_30.html,2023-12-30T09:15:00,0,,,,,,,,,,,,,,,,,,,,,,,,,,,,,,,,,,,,,,,,,,,,,
Cousas de Carragal,MARÍN EL SEMANAL DE CARRAGAL. RESUMEN DE NOTICIAS DESTACADAS.,https://cousasdecarragal.blogspot.com/2023/12/marin-el-semanal-de-carragal-resumen-de_29.html,2023-12-29T07:49:00,0,,,,,,,,,,,,,,,,,,,,,,,,,,,,,,,,,,,,,,,,,,,,,
Cousas de Carragal,MARÍN. BUENAS NOTICIAS. PROYECTO DE DERRIBO DE LA NAVE-ALMACÉN DE CEFERINO NOGUEIRA,https://cousasdecarragal.blogspot.com/2023/12/marin-buenas-noticias-proyecto-de.html,2023-12-28T11:00:00,0,,,,,,,,,,,,,,,,,,,,,,,,,,,,,,,,,,,,,,,,,,,,,
Cousas de Carragal,MARÍN. DEFUNCIONES. FALLECIMIENTOS DE NIEVES FUENTES (64 AÑOS). SERÁFÍN ACUÑA (50 AÑOS) Y JOSÉ CARLOS MARTÍNEZ (52 AÑOS) DEP,https://cousasdecarragal.blogspot.com/2023/12/marin-defunciones-fallecimientos-de.html,2023-12-26T08:56:00,0,,,,,,,,,,,,,,,,,,,,,,,,,,,,,,,,,,,,,,,,,,,,,
Cousas de Carragal,MARÍN. FRUSTRADA EXPOSICIÓN DE ARTE EN TALLA DE MADERA EN EL MUSEO MANUEL TORRES. POR ANGEL G. CARRAGAL,https://cousasdecarragal.blogspot.com/2023/12/marin-frustrada-exposicion-de-arte-en.html,2023-12-26T07:24:00,0,,,,,,,,,,,,,,,,,,,,,,,,,,,,,,,,,,,,,,,,,,,,,
Cousas de Carragal,MARÍN. LA ENTREVISTA DEL DOMINGO. HOY: ADRIÁN ARIAS CARRACELAS. PRESIDENTE DE LAS NN. XX DO PP,https://cousasdecarragal.blogspot.com/2023/12/marin-la-entrevista-del-domingo-hoy.html,2023-12-24T08:20:00,0,,,,,,,,,,,,,,,,,,,,,,,,,,,,,,,,,,,,,,,,,,,,,
Cousas de Carragal,MARÍN. EL SEMANAL DE CARRAGAL. RESUMEN DE LAS NOTICIAS MÁS DESTACADAS,https://cousasdecarragal.blogspot.com/2023/12/marin-el-semanal-de-carragal-resumen-de_21.html,2023-12-21T09:42:00,0,,,,,,,,,,,,,,,,,,,,,,,,,,,,,,,,,,,,,,,,,,,,,
Cousas de Carragal,MARIN. FALLECIMIENTO DE CONSUELO MARTÍNEZ MARCOS A LOS 75 AÑOS DE EDAD,https://cousasdecarragal.blogspot.com/2023/12/marin-fallecimiento-de-consuelo.html,2023-12-18T09:46:00,0,,,,,,,,,,,,,,,,,,,,,,,,,,,,,,,,,,,,,,,,,,,,,
Cousas de Carragal,REFLEXIÓN NAVIDEÑA. NOSTALGIA DE LA NAVIDAD DE MI INFANCIA. POR ANGEL G. CARRAGAL,https://cousasdecarragal.blogspot.com/2023/12/reflexion-navidena-nostalgia-de-la.html,2023-12-18T08:10:00,0,,,,,,,,,,,,,,,,,,,,,,,,,,,,,,,,,,,,,,,,,,,,,
Cousas de Carragal,MARÍN. INTENSO FIN DE SEMANA NAVIDEÑO,https://cousasdecarragal.blogspot.com/2023/12/marin-intenso-fin-de-semana-navideno_16.html,2023-12-16T08:40:00,0,,,,,,,,,,,,,,,,,,,,,,,,,,,,,,,,,,,,,,,,,,,,,
Cousas de Carragal,MARIN. INTENSO FIN DE SEMANA NAVIDEÑO,https://cousasdecarragal.blogspot.com/2023/12/marin-intenso-fin-de-semana-navideno.html,2023-12-15T08:33:00,0,,,,,,,,,,,,,,,,,,,,,,,,,,,,,,,,,,,,,,,,,,,,,
Cousas de Carragal,MARÍN. EL SEMANAL DE CARRAGAL. RESUMEN DE NOTICIAS DESTACADAS,https://cousasdecarragal.blogspot.com/2023/12/marin-el-semanal-de-carragal-resumen-de_14.html,2023-12-14T09:52:00,0,,,,,,,,,,,,,,,,,,,,,,,,,,,,,,,,,,,,,,,,,,,,,
